{
  "$schema": "http://json-schema.org/draft-07/schema#",
  "title": "MASQUE population estimates artifact",
  "description": "The contract between the offline, design-aware survey estimation step and the ResearchReadinessPanel. The panel RENDERS this file; it never computes it. See README_DATA_CONNECTION.md for why that separation is not negotiable.",
  "type": "object",
  "required": ["masqueArtifact", "source", "design", "phenotype", "estimates", "generatedAt"],
  "properties": {
    "masqueArtifact": {
      "const": "population-estimates",
      "description": "Marker the panel keys on to tell an estimates artifact apart from a cohort row file."
    },
    "generatedAt": { "type": "string", "format": "date-time" },
    "producedBy": {
      "type": "string",
      "description": "Script and version that produced this, e.g. 'masque_population_etl.R 0.1.0 / R survey 4.4-2'. Required for the §8 reproducibility check."
    },
    "source": {
      "type": "object",
      "required": ["dataset", "cycle", "file", "steward"],
      "properties": {
        "dataset": { "type": "string", "examples": ["NHIS", "NHANES", "MEPS"] },
        "cycle": { "type": "string", "examples": ["2024", "2017-2018"] },
        "file": { "type": "string", "description": "Public-use file actually read." },
        "steward": { "type": "string", "examples": ["CDC/NCHS", "AHRQ"] },
        "url": { "type": "string" },
        "downloadedAt": { "type": "string" },
        "sha256": { "type": "string", "description": "Hash of the file as downloaded. Without it the estimate is not reproducible." }
      }
    },
    "design": {
      "type": "object",
      "description": "The design specification actually used. Present so a reader can verify the estimate is design-aware rather than a naive weighted mean.",
      "required": ["weight", "strata", "psu", "nest"],
      "properties": {
        "weight": { "type": "string", "examples": ["WTFA_A", "WTMEC2YR"] },
        "strata": { "type": "string", "examples": ["PSTRAT", "SDMVSTRA"] },
        "psu": { "type": "string", "examples": ["PPSU", "SDMVPSU"] },
        "nest": { "type": "boolean" },
        "lonelyPsu": { "type": "string", "examples": ["adjust"] },
        "varianceMethod": { "type": "string", "examples": ["Taylor linearization", "BRR", "jackknife"] },
        "domainAnalysis": {
          "type": "boolean",
          "description": "True if subpopulation estimates were produced by subsetting the DESIGN (subset()) rather than the data frame. Filtering rows before building the design breaks variance estimation; this flag exists so a reviewer can check it was done correctly."
        }
      }
    },
    "phenotype": {
      "type": "object",
      "description": "The §7.1 computable phenotype as applied, in enough detail to re-derive it.",
      "required": ["definition", "variableMap"],
      "properties": {
        "definition": { "type": "string" },
        "variableMap": { "type": "object", "description": "Concept -> survey variable, from the mapping file." },
        "mapFile": { "type": "string" },
        "mapVersion": { "type": "string" },
        "unmapped": {
          "type": "array",
          "items": { "type": "string" },
          "description": "Concepts the chosen cycle cannot express. NEVER silently dropped — a phenotype missing its vestibular component is a different phenotype and the panel must say so."
        }
      }
    },
    "estimates": {
      "type": "array",
      "description": "One entry per reported quantity. Every entry carries an interval and an unweighted denominator; a point estimate with neither is not reportable.",
      "items": {
        "type": "object",
        "required": ["name", "estimate", "se", "ci", "unweightedN"],
        "properties": {
          "name": { "type": "string", "examples": ["phenotype_prevalence", "annual_cost_mean"] },
          "domain": { "type": "string", "description": "Subgroup, e.g. 'sex=female'. Omit for the total." },
          "estimate": { "type": "number" },
          "se": { "type": "number" },
          "ci": { "type": "array", "items": { "type": "number" }, "minItems": 2, "maxItems": 2 },
          "unweightedN": { "type": "integer" },
          "weightedN": { "type": "number" },
          "df": { "type": "integer", "description": "Design degrees of freedom — strata minus PSUs, not sample size." },
          "rse": { "type": "number", "description": "Relative standard error. NCHS presentation standards suppress estimates above a threshold; the panel honours the suppress flag rather than deciding for itself." },
          "suppress": { "type": "boolean", "description": "Set by the ETL per the steward's own presentation standard. The panel shows the cell as suppressed and never prints the value." },
          "suppressReason": { "type": "string" }
        }
      }
    },
    "caveats": {
      "type": "array",
      "items": { "type": "string" },
      "description": "Rendered verbatim by the panel beneath the numbers. This is where 'screening-level, not diagnosed prevalence' lives."
    }
  }
}
