{
  "masqueArtifact": "population-estimates",
  "generatedAt": "2026-09-24T22:29:28Z",
  "producedBy": "masque_population_etl.R 0.3.0 / R survey 4.2.1",
  "source": {
    "dataset": "SYNTHETIC-NHANES-SHAPED",
    "cycle": "fixture",
    "file": "nhanes_synthetic.csv",
    "steward": "CDC/NCHS",
    "url": "https://wwwn.cdc.gov/nchs/nhanes/",
    "sha256": "4c8ecf15ad51ca93b2d559f5c63c028520e755b409ca22946eb1dce773418206",
    "downloadedAt": "2026-09-24"
  },
  "design": {
    "weight": "WTINT2YR",
    "strata": "SDMVSTRA",
    "psu": "SDMVPSU",
    "nest": true,
    "lonelyPsu": "adjust",
    "varianceMethod": "Taylor linearization",
    "domainAnalysis": true
  },
  "phenotype": {
    "definition": "SYNTHETIC FIXTURE: headache_migraine positive AND (dizziness_balance positive OR hearing_difficulty positive). Invented variables; not a survey estimate.",
    "rule": {
      "all": ["headache_migraine"],
      "any": ["dizziness_balance", "hearing_difficulty"],
      "completeCase": true
    },
    "variableMap": {
      "headache_migraine": "SYN_MPQ1",
      "dizziness_balance": ["SYN_BAQ1", "SYN_BAQ2"],
      "hearing_difficulty": "SYN_AUQ1",
      "sinus_condition": null,
      "recalcitrance_proxy": null
    },
    "questionText": {
      "headache_migraine": "SYNTHETIC",
      "dizziness_balance": "SYNTHETIC",
      "hearing_difficulty": "SYNTHETIC",
      "sinus_condition": "",
      "recalcitrance_proxy": ""
    },
    "mapFile": "phenotype_map_nhanes_synthetic.json",
    "mapVersion": "0.0.0-synthetic",
    "unmapped": ["sinus_condition", "recalcitrance_proxy"]
  },
  "estimates": [
    {
      "name": "phenotype_prevalence",
      "unit": "proportion",
      "estimate": 0.0684545173714548,
      "se": 0.00705838357611832,
      "ci": [0.0534099289057509, 0.0834991058371588],
      "unweightedN": 769,
      "weightedN": 23457532.12,
      "df": 15,
      "rse": 0.103110559348734,
      "suppress": false
    },
    {
      "name": "phenotype_prevalence",
      "unit": "proportion",
      "domain": "sex=male",
      "estimate": 0.0429617201093342,
      "se": 0.0106186331171723,
      "ci": [0.0203286393772714, 0.065594800841397],
      "unweightedN": 279,
      "weightedN": 8418499.75,
      "df": 15,
      "rse": 0.2471649899061,
      "suppress": false
    },
    {
      "name": "phenotype_prevalence",
      "unit": "proportion",
      "domain": "sex=female",
      "estimate": 0.0827247910232406,
      "se": 0.00873581952588568,
      "ci": [0.0641048324646993, 0.101344749581782],
      "unweightedN": 490,
      "weightedN": 15039032.37,
      "df": 15,
      "rse": 0.10560098632865,
      "suppress": false
    }
  ],
  "caveats": ["Screening-level phenotype prevalence, not diagnosed prevalence. No vestibular-testing or ICHD/Barany reference standard exists in these data.", "Self-reported survey items; coding inconsistency may bias phenotype capture.", "Hypothesis-generating estimate, not a diagnostic count.", "Respondents coded Refused / Not Ascertained / Don't Know on a phenotype item are excluded from the denominator, never counted as negative.", "Complete-case phenotype: a respondent missing any item the rule uses is excluded from the denominator.", "Concepts this cycle could not express: sinus_condition, recalcitrance_proxy. The phenotype reported here is narrower than the one defined in proposal 7.1.", "No gender-identity item in this cycle: estimates are stratified by sex only. Gender is not substituted from sex."]
}
