{
  "masqueArtifact": "population-estimates",
  "generatedAt": "2026-09-24T22:29:27Z",
  "producedBy": "masque_population_etl.R 0.3.0 / R survey 4.2.1",
  "source": {
    "dataset": "SYNTHETIC",
    "cycle": "fixture",
    "file": "synthetic_nhis_like.csv",
    "steward": "none (test fixture)",
    "url": "",
    "sha256": "8e802a93e2405320f5823b99c7171e0d189d030f2df2d25369bebe65a5770d7f",
    "downloadedAt": "2026-09-24"
  },
  "design": {
    "weight": "WTFA_A",
    "strata": "PSTRAT",
    "psu": "PPSU",
    "nest": true,
    "lonelyPsu": "adjust",
    "varianceMethod": "Taylor linearization",
    "domainAnalysis": true
  },
  "phenotype": {
    "definition": "SYNTHETIC FIXTURE: headache_migraine positive AND (dizziness_balance positive OR hearing_difficulty positive). Invented variables; not a survey estimate.",
    "rule": {
      "all": ["headache_migraine"],
      "any": ["dizziness_balance", "hearing_difficulty"],
      "completeCase": true
    },
    "variableMap": {
      "headache_migraine": "SYN_HEAD",
      "dizziness_balance": "SYN_DIZZ",
      "hearing_difficulty": "SYN_HEAR",
      "sinus_condition": null,
      "recalcitrance_proxy": null
    },
    "questionText": {
      "headache_migraine": "SYNTHETIC: invented headache item",
      "dizziness_balance": "SYNTHETIC: invented dizziness item",
      "hearing_difficulty": "SYNTHETIC: invented hearing item",
      "sinus_condition": "",
      "recalcitrance_proxy": ""
    },
    "mapFile": "phenotype_map_synthetic.json",
    "mapVersion": "0.0.0-synthetic",
    "unmapped": ["sinus_condition", "recalcitrance_proxy"]
  },
  "estimates": [
    {
      "name": "phenotype_prevalence",
      "unit": "proportion",
      "estimate": 0.0423834961737181,
      "se": 0.009141151883557,
      "ci": [0.0233153874787127, 0.0614516048687235],
      "unweightedN": 563,
      "weightedN": 2775349.62,
      "df": 20,
      "rse": 0.215677155232545,
      "suppress": false
    },
    {
      "name": "phenotype_prevalence",
      "unit": "proportion",
      "domain": "sex=male",
      "estimate": 0.0324210386055706,
      "se": 0.0126066238556263,
      "ci": [0.00612408204930432, 0.058717995161837],
      "unweightedN": 182,
      "weightedN": 905986.09,
      "df": 20,
      "rse": 0.388840839092064,
      "suppress": true,
      "suppressReason": "RSE > 30% or unweighted n < 30 (NCHS presentation standard)"
    },
    {
      "name": "phenotype_prevalence",
      "unit": "proportion",
      "domain": "sex=female",
      "estimate": 0.0472117961988913,
      "se": 0.0126845100430825,
      "ci": [0.0207523719025443, 0.0736712204952382],
      "unweightedN": 381,
      "weightedN": 1869363.53,
      "df": 20,
      "rse": 0.268672473075287,
      "suppress": false
    }
  ],
  "caveats": ["Screening-level phenotype prevalence, not diagnosed prevalence. No vestibular-testing or ICHD/Barany reference standard exists in these data.", "Self-reported survey items; coding inconsistency may bias phenotype capture.", "Hypothesis-generating estimate, not a diagnostic count.", "Respondents coded Refused / Not Ascertained / Don't Know on a phenotype item are excluded from the denominator, never counted as negative.", "Complete-case phenotype: a respondent missing any item the rule uses is excluded from the denominator.", "Concepts this cycle could not express: sinus_condition, recalcitrance_proxy. The phenotype reported here is narrower than the one defined in proposal 7.1.", "No gender-identity item in this cycle: estimates are stratified by sex only. Gender is not substituted from sex."]
}
